{
  "schema_version": "1.3.0",
  "benchmark": "LongRCA Bench",
  "evaluation_split": "public",
  "generated_at": "2026-08-20",
  "paper_url": "https://arxiv.org/abs/2608.15242",
  "dataset_url": "https://huggingface.co/datasets/CLoud5-real/longrca-bench",
  "sort": {
    "metric": "root_exact",
    "direction": "descending"
  },
  "benchmark_slices": [
    {
      "id": "swe_bench_pro",
      "label": "SWE-bench Pro",
      "n": 128
    },
    {
      "id": "terminal_bench_2",
      "label": "Terminal-Bench 2",
      "n": 42
    },
    {
      "id": "travelplanner",
      "label": "TravelPlanner",
      "n": 685
    },
    {
      "id": "vitabench",
      "label": "VitaBench",
      "n": 108
    },
    {
      "id": "webarena_verified",
      "label": "WebArena",
      "n": 177
    }
  ],
  "results": [
    {
      "id": "rcta-deepseek-v4-flash-paper",
      "method": "RCTA",
      "display_name": "RCTA",
      "citation_label": "LongRCA",
      "model": "DeepSeek-V4-Flash",
      "provider": "DeepSeek",
      "n": 1140,
      "role_correct": 583,
      "root_exact_correct": 275,
      "root_within_5_correct": 426,
      "root_mae": 38.6140350877193,
      "valid_step_n": 1140,
      "failed_n": 0,
      "by_benchmark": {
        "swe_bench_pro": {
          "n": 128,
          "root_exact_correct": 49
        },
        "terminal_bench_2": {
          "n": 42,
          "root_exact_correct": 11
        },
        "travelplanner": {
          "n": 685,
          "root_exact_correct": 129
        },
        "vitabench": {
          "n": 108,
          "root_exact_correct": 27
        },
        "webarena_verified": {
          "n": 177,
          "root_exact_correct": 59
        }
      },
      "date": "2026-08-20",
      "status": "Paper Result",
      "links": {
        "paper": "https://arxiv.org/abs/2608.15242"
      }
    },
    {
      "id": "echo-deepseek-v4-flash-paper",
      "method": "ECHO",
      "display_name": "ECHO",
      "citation_label": "ECHO",
      "model": "DeepSeek-V4-Flash",
      "provider": "DeepSeek",
      "n": 1140,
      "role_correct": 314,
      "root_exact_correct": 150,
      "root_within_5_correct": 282,
      "root_mae": 50.396491228070175,
      "valid_step_n": 1140,
      "failed_n": 0,
      "by_benchmark": {
        "swe_bench_pro": {
          "n": 128,
          "root_exact_correct": 10
        },
        "terminal_bench_2": {
          "n": 42,
          "root_exact_correct": 9
        },
        "travelplanner": {
          "n": 685,
          "root_exact_correct": 61
        },
        "vitabench": {
          "n": 108,
          "root_exact_correct": 24
        },
        "webarena_verified": {
          "n": 177,
          "root_exact_correct": 46
        }
      },
      "date": "2026-08-20",
      "status": "Paper Result",
      "links": {
        "paper": "https://arxiv.org/abs/2510.04886"
      }
    },
    {
      "id": "all-at-once-deepseek-v4-flash-paper",
      "method": "All-at-once",
      "display_name": "LLM-as-a-Judge / All-at-once",
      "citation_label": "Who&When",
      "model": "DeepSeek-V4-Flash",
      "provider": "DeepSeek",
      "n": 1140,
      "role_correct": 299,
      "root_exact_correct": 87,
      "root_within_5_correct": 227,
      "root_mae": 55.937183450550016,
      "valid_step_n": 1136,
      "failed_n": 4,
      "by_benchmark": {
        "swe_bench_pro": {
          "n": 128,
          "root_exact_correct": 2
        },
        "terminal_bench_2": {
          "n": 42,
          "root_exact_correct": 3
        },
        "travelplanner": {
          "n": 685,
          "root_exact_correct": 31
        },
        "vitabench": {
          "n": 108,
          "root_exact_correct": 21
        },
        "webarena_verified": {
          "n": 177,
          "root_exact_correct": 30
        }
      },
      "date": "2026-08-20",
      "status": "Paper Result",
      "links": {
        "paper": "https://proceedings.mlr.press/v267/zhang25cq.html"
      }
    },
    {
      "id": "step-by-step-deepseek-v4-flash-paper",
      "method": "Step-by-step",
      "display_name": "LLM-as-a-Judge / Step-by-step",
      "citation_label": "Who&When",
      "model": "DeepSeek-V4-Flash",
      "provider": "DeepSeek",
      "n": 1140,
      "role_correct": 253,
      "root_exact_correct": 60,
      "root_within_5_correct": 193,
      "root_mae": 52.26005565815123,
      "valid_step_n": 1139,
      "failed_n": 1,
      "by_benchmark": {
        "swe_bench_pro": {
          "n": 128,
          "root_exact_correct": 1
        },
        "terminal_bench_2": {
          "n": 42,
          "root_exact_correct": 2
        },
        "travelplanner": {
          "n": 685,
          "root_exact_correct": 24
        },
        "vitabench": {
          "n": 108,
          "root_exact_correct": 13
        },
        "webarena_verified": {
          "n": 177,
          "root_exact_correct": 20
        }
      },
      "date": "2026-08-20",
      "status": "Paper Result",
      "links": {
        "paper": "https://proceedings.mlr.press/v267/zhang25cq.html"
      }
    },
    {
      "id": "binary-search-deepseek-v4-flash-paper",
      "method": "Binary search",
      "display_name": "Binary search",
      "citation_label": "Who&When",
      "model": "DeepSeek-V4-Flash",
      "provider": "DeepSeek",
      "n": 1140,
      "role_correct": 262,
      "root_exact_correct": 39,
      "root_within_5_correct": 152,
      "root_mae": 61.708771929824564,
      "valid_step_n": 1140,
      "failed_n": 0,
      "by_benchmark": {
        "swe_bench_pro": {
          "n": 128,
          "root_exact_correct": 1
        },
        "terminal_bench_2": {
          "n": 42,
          "root_exact_correct": 2
        },
        "travelplanner": {
          "n": 685,
          "root_exact_correct": 14
        },
        "vitabench": {
          "n": 108,
          "root_exact_correct": 13
        },
        "webarena_verified": {
          "n": 177,
          "root_exact_correct": 9
        }
      },
      "date": "2026-08-20",
      "status": "Paper Result",
      "links": {
        "paper": "https://proceedings.mlr.press/v267/zhang25cq.html"
      }
    },
    {
      "id": "falat-deepseek-v4-flash-paper",
      "method": "FALAT",
      "display_name": "FALAT",
      "citation_label": "FALAT",
      "model": "DeepSeek-V4-Flash",
      "provider": "DeepSeek",
      "n": 1140,
      "role_correct": 217,
      "root_exact_correct": 32,
      "root_within_5_correct": 142,
      "root_mae": 66.6061403508772,
      "valid_step_n": 1140,
      "failed_n": 0,
      "by_benchmark": {
        "swe_bench_pro": {
          "n": 128,
          "root_exact_correct": 3
        },
        "terminal_bench_2": {
          "n": 42,
          "root_exact_correct": 1
        },
        "travelplanner": {
          "n": 685,
          "root_exact_correct": 20
        },
        "vitabench": {
          "n": 108,
          "root_exact_correct": 4
        },
        "webarena_verified": {
          "n": 177,
          "root_exact_correct": 4
        }
      },
      "date": "2026-08-20",
      "status": "Paper Result",
      "links": {
        "paper": "https://arxiv.org/abs/2606.00765"
      }
    }
  ]
}
